{
  "alerts": [],
  "api_version": 1,
  "clock": {
    "date": "Monday, October 12",
    "day": "2026-10-12",
    "iso": "2026-10-12T14:32:00+02:00",
    "time": "14:32",
    "tz": "Europe/Berlin",
    "unix": 1791808320,
    "utc_offset_minutes": 120
  },
  "dir": "ltr",
  "household": "Home",
  "is_night": true,
  "locale": "en",
  "night": {
    "date": "Monday, October 12",
    "item": {
      "icon": {
        "code": "1f392",
        "text": "🎒"
      },
      "people": [
        "u-mia"
      ],
      "time": "07:30",
      "title": "School",
      "when": "tomorrow",
      "when_label": "Tomorrow"
    },
    "time": "14:32",
    "wake_hint": "Tap to show the dashboard"
  },
  "overview": {
    "chores": {
      "items": [
        {
          "due": null,
          "id": "t1",
          "late": null,
          "people": [
            "u-mia"
          ],
          "state": "open",
          "state_label": "To do",
          "title": "Empty dishwasher"
        },
        {
          "due": null,
          "id": "t2",
          "late": "2 days late",
          "people": [
            "u-pascal"
          ],
          "state": "overdue",
          "state_label": "Overdue",
          "title": "Taxes"
        },
        {
          "due": null,
          "id": "t3",
          "late": null,
          "people": [
            "u-anna"
          ],
          "state": "done",
          "state_label": "Done",
          "title": "Laundry"
        }
      ],
      "label": "Chores today · 2 open"
    },
    "messages": null,
    "next": {
      "color": "#357bbb",
      "icon": null,
      "kind": "next",
      "label": "Next",
      "people": [
        "u-leo"
      ],
      "rel": "in 28 min",
      "time": "15:00",
      "title": "Swimming"
    },
    "notes": {
      "items": [
        {
          "color": "#ffee88",
          "dark": {
            "bg": "#bdb168",
            "ink": "#1f1d1a"
          },
          "id": "n1",
          "light": {
            "bg": "#fdef9d",
            "ink": "#1f1d1a"
          },
          "text": "Plumber Tue 9am"
        },
        {
          "color": null,
          "dark": null,
          "id": "n2",
          "light": null,
          "text": "Bad colour"
        }
      ],
      "label": "Notes · 2",
      "see_all": false
    },
    "presence": {
      "away": {
        "icon": {
          "code": "1f697",
          "text": "🚗"
        },
        "label": "Away",
        "people": [
          {
            "id": "u-anna",
            "zone": "Work"
          },
          {
            "id": "u-leo",
            "zone": null
          }
        ]
      },
      "home": {
        "icon": {
          "code": "1f3e0",
          "text": "🏠"
        },
        "label": "Home",
        "people": [
          "u-pascal",
          "u-mia"
        ]
      },
      "label": "Who's home"
    },
    "shopping": {
      "items": [
        "Milk",
        "Bread",
        "Eggs",
        "Apples",
        "Rice",
        "Tea"
      ],
      "label": "Shopping · 11",
      "more": "+ 5 more"
    },
    "today": {
      "at_school": {
        "items": [
          {
            "icon": {
              "code": "1f3a8",
              "text": "🎨"
            },
            "people": [
              "u-mia"
            ],
            "title": "Art",
            "until": "until 15:00"
          }
        ],
        "label": "At school now"
      },
      "changes": {
        "items": [
          {
            "meta": null,
            "people": [
              "u-mia"
            ],
            "status": "cancelled",
            "status_label": "Cancelled",
            "title": "10:15 Sport",
            "who": "Mia"
          },
          {
            "meta": "Room B7",
            "people": [
              "u-mia"
            ],
            "status": "changed",
            "status_label": "Changed",
            "title": "14:00 Art",
            "who": "Mia"
          },
          {
            "meta": null,
            "people": [
              "u-mia"
            ],
            "status": "added",
            "status_label": "Added",
            "title": "15:05 English",
            "who": "Mia"
          }
        ],
        "label": "School changes today"
      },
      "empty": null,
      "empty_icon": null,
      "label": "Today",
      "list": [
        {
          "color": "#357bbb",
          "icon": null,
          "is_break": false,
          "kind": "event",
          "meta": null,
          "now": false,
          "past": false,
          "people": [
            "u-mia"
          ],
          "status": null,
          "status_label": null,
          "time": "All day",
          "title": "Mia's birthday"
        },
        {
          "color": null,
          "icon": {
            "code": "1f392",
            "text": "🎒"
          },
          "is_break": false,
          "kind": "school",
          "meta": null,
          "now": false,
          "past": false,
          "people": [
            "u-mia"
          ],
          "status": null,
          "status_label": null,
          "time": "08:20–15:50",
          "title": "School"
        },
        {
          "color": "#c44d72",
          "icon": null,
          "is_break": false,
          "kind": "event",
          "meta": null,
          "now": true,
          "past": false,
          "people": [
            "u-anna"
          ],
          "status": null,
          "status_label": null,
          "time": "09:00–17:00",
          "title": "Work"
        },
        {
          "color": "#357bbb",
          "icon": null,
          "is_break": false,
          "kind": "event",
          "meta": null,
          "now": false,
          "past": true,
          "people": [
            "u-pascal"
          ],
          "status": null,
          "status_label": null,
          "time": "10:00–11:00",
          "title": "Dentist"
        },
        {
          "color": "#357bbb",
          "icon": null,
          "is_break": false,
          "kind": "event",
          "meta": null,
          "now": false,
          "past": false,
          "people": [
            "u-leo"
          ],
          "status": null,
          "status_label": null,
          "time": "15:00–16:00",
          "title": "Swimming"
        },
        {
          "color": "#357bbb",
          "icon": null,
          "is_break": false,
          "kind": "event",
          "meta": null,
          "now": false,
          "past": false,
          "people": [
            "u-pascal",
            "u-anna",
            "u-mia",
            "u-leo"
          ],
          "status": null,
          "status_label": null,
          "time": "18:30–20:00",
          "title": "Dinner with Gran"
        }
      ],
      "mode": "timeline",
      "timeline": {
        "end_hour": 22,
        "label": "Today's timeline",
        "lanes": [
          {
            "all_day": [],
            "blocks": [
              {
                "icon": {
                  "code": "1f9b7",
                  "text": "🦷"
                },
                "kind": "event",
                "label": "10:00–11:00 Dentist",
                "more": 0,
                "narrow": true,
                "past": true,
                "row": 0,
                "title": "Dentist",
                "w": 7,
                "x": 14
              },
              {
                "icon": {
                  "code": "1f35d",
                  "text": "🍝"
                },
                "kind": "event",
                "label": "18:30–20:00 Dinner with Gran",
                "more": 0,
                "narrow": false,
                "past": false,
                "row": 0,
                "title": "Dinner with Gran",
                "w": 11,
                "x": 75
              }
            ],
            "color": "#357bbb",
            "ink": "#000000",
            "person": "u-pascal",
            "rows": 1
          },
          {
            "all_day": [],
            "blocks": [
              {
                "icon": {
                  "code": "1f4bc",
                  "text": "💼"
                },
                "kind": "event",
                "label": "09:00–17:00 Work",
                "more": 0,
                "narrow": false,
                "past": false,
                "row": 0,
                "title": "Work",
                "w": 57,
                "x": 7
              },
              {
                "icon": {
                  "code": "1f35d",
                  "text": "🍝"
                },
                "kind": "event",
                "label": "18:30–20:00 Dinner with Gran",
                "more": 0,
                "narrow": false,
                "past": false,
                "row": 0,
                "title": "Dinner with Gran",
                "w": 11,
                "x": 75
              }
            ],
            "color": "#c44d72",
            "ink": "#000000",
            "person": "u-anna",
            "rows": 1
          },
          {
            "all_day": [
              "Mia's birthday"
            ],
            "blocks": [
              {
                "icon": {
                  "code": "1f392",
                  "text": "🎒"
                },
                "kind": "school",
                "label": "08:20–15:50 School",
                "more": 0,
                "narrow": false,
                "past": false,
                "row": 0,
                "title": "School",
                "w": 54,
                "x": 2
              },
              {
                "icon": {
                  "code": "1f35d",
                  "text": "🍝"
                },
                "kind": "event",
                "label": "18:30–20:00 Dinner with Gran",
                "more": 0,
                "narrow": false,
                "past": false,
                "row": 0,
                "title": "Dinner with Gran",
                "w": 11,